{"$schema":"https://json-schema.org/draft/2020-12/schema","authority_line":"cross_line","derivation_edges":[{"derivation":"E-C2-SOURCE-PARSE","edge_id":"edge-10eec14a703a2626281fa0aadea58d2cf061ba7e65101aea650cd9b3917c75e1","edge_type":"authority_input","from_ref_ids":["src-443ed153708b3c8bbefe89c53bbc7622d46e60a46435f251864b3e175d619a1b"],"to_row_ids":["row-fccb1304de56c1c5f2f1463f8e51c62ca4368efe2cfcde3d799d4ece1292328c"]},{"derivation":"E-C2-SOURCE-PARSE","edge_id":"edge-180ba666e210b40a81622d102d698e1d9a6b7715c0fdf31501a98037964a7f7f","edge_type":"authority_input","from_ref_ids":["src-bea1788c7aaa661087f7c3a67ec839c3aeb4430821a40075ffcb10c48751b2cf"],"to_row_ids":["row-b17d980cadf9c6fdf86288a47b5b5c23d3a81c324d1eb34dac31785d75d94c8b"]},{"derivation":"E-C2-SOURCE-PARSE","edge_id":"edge-1d4fc08f2c63721622adad9b372684d2d830881e7e0299b993b219bf404ba56f","edge_type":"authority_input","from_ref_ids":["src-0fd492a595e7be7d3c18ee45125172528c0e44cff2fed99663a7c66741aafca2"],"to_row_ids":["row-c0573f9138f133c9ef1502eae37f4b4d455289d761561b615df9add4d68dac69"]},{"derivation":"E-C2-SOURCE-PARSE","edge_id":"edge-24588d9ad8b388f70fc21a89bedd366c233e16591d756a6d8f3f471e6a681fea","edge_type":"authority_input","from_ref_ids":["src-5c9bde051652ecbdf815ae1a795120261bb5a53e4ba2c11fd7c214de0e7ea7e1"],"to_row_ids":["row-d7e4480dc03122cd600ab29d01606b48e9620b01677128ea6360da4227c17057"]},{"derivation":"E-C2-SOURCE-PARSE","edge_id":"edge-298eefb2a02a044358e14c7983299df5d4c34623c1b016ac710f1ac47ed72e68","edge_type":"authority_input","from_ref_ids":["src-e9ef07602dc9d92ced3c563be8ff4e3f5a68ab29e0fa1d4010377fa63627cee9"],"to_row_ids":["row-222ab984450e89b821134e2784c773d415311d3377e450691c96e6fda6b8066a"]},{"derivation":"E-C2-SOURCE-PARSE","edge_id":"edge-3b67b6fad085ea1c7c6afbbdbc7685de3540abd0ea59ec0eea06d5c6336a0d28","edge_type":"authority_input","from_ref_ids":["src-a80a933ae5634f512983daea7781ea53050e276e1c3cdf3f211c7ee7a9f219db"],"to_row_ids":["row-fbd356ab77b6e2ad4bd2849ccc6f82be08820cbdd8ba4b6d1157cc2350762584"]},{"derivation":"E-C2-SOURCE-PARSE","edge_id":"edge-3e3981523d8bd7baddc32154a073f82d18af45962caf9f1936c591a19f5bfc74","edge_type":"authority_input","from_ref_ids":["src-f176463e5f317a755622108769a1f9cbdfb60813afb7375ad63c5902ca5ad6e4"],"to_row_ids":["row-5d5d6d131a918b1e9de4bde8d98a2e09dcf99e41c47a91be4e74a79666eab614"]},{"derivation":"E-C2-SOURCE-PARSE","edge_id":"edge-54d822ff5e4fd0113b686b2659af49b6452d7edde0397b13df22a7f0c06c2e8c","edge_type":"authority_input","from_ref_ids":["src-a26206319b5d09a21f3c2b4bd2d9075d87e3d61fbcab1ac4c3d8cd4ee4b5cb4f"],"to_row_ids":["row-6beb48204dda8d7657f8bb2a8170aa3660bc99988ca061aac6403cedee691158"]},{"derivation":"E-C2-SOURCE-PARSE","edge_id":"edge-5882649164640a660a1d1f049f41afdc53882266cb5673cf17f506d36230c856","edge_type":"authority_input","from_ref_ids":["src-408cf814eb4a2fa2bffa997c5010c4f72f05a1559624c6e7c09e7f04e348559c"],"to_row_ids":["row-52229594148f629afc751c7827bcc6c4bf98e2b0d86c16721ee656db35b19067"]},{"derivation":"E-C2-SOURCE-PARSE","edge_id":"edge-5f22d362e61ee1379a302893ca6eb65d468f80add9fc49b5af54953ae8a3de5e","edge_type":"authority_input","from_ref_ids":["src-691a410eeb434057855a9cbb166996e712300776f8cb80ab6a70e04a49066804"],"to_row_ids":["row-9e700ebf5c3bd37dc0e9278d95fed84ed4629c222d5eb5c64aafe48030cc54c9"]},{"derivation":"E-C2-SOURCE-PARSE","edge_id":"edge-5ffd47b1030a235e8c1cf70732e7216339156f25ee7a059f25cf99521a12911b","edge_type":"authority_input","from_ref_ids":["src-a36705bc1dff805e2bb5164eb6459af51713e6c4de24eed6d670857afd86fe7a"],"to_row_ids":["row-a3a44ce3c0147de7a44cf79d1f70d006bc0efd0f1f572570c6d086d58c61a113"]},{"derivation":"E-C2-SOURCE-PARSE","edge_id":"edge-618fe0fdc58db8404b68a8c5a8fd204e6ca6de87001464b6512f8b8408364bee","edge_type":"authority_input","from_ref_ids":["src-595c723cd4185c85144f3f67ed6a2bf2d91d20a7e967d442afbe62d0a9572a0c"],"to_row_ids":["row-a2d6e2bc98c08094520c3d97fc5cd3f125c399f9a90bc846eeaf59a7195d2361"]},{"derivation":"E-C2-SOURCE-PARSE","edge_id":"edge-773b23a076aac99845a1461d7cf7ab13e1f487f3285af75db9cda41b52977bc9","edge_type":"authority_input","from_ref_ids":["src-d3e67be9dadd8fee52df7e129e1c423e4567c5859c994aabea2f8d3bdb66cb3a"],"to_row_ids":["row-6cf106ef9509098360839638f06029d6930c8807ad08a77d55766c02173c0dd4"]},{"derivation":"E-C2-SOURCE-PARSE","edge_id":"edge-82caeef428ec22a4635665d9849044e1fb10785aa05cec9206286543e4347f6d","edge_type":"authority_input","from_ref_ids":["src-5338f2061cf1aaea28c1376317bf9507fe4b9d5dd4e6eaa18a05b19c477d8b33"],"to_row_ids":["row-1a21ceded38b7f68ce44c6b1a4ad6dc87697a50db205575a9d6a21404c5a7809"]},{"derivation":"E-C2-SOURCE-PARSE","edge_id":"edge-87bfa5ac1194e973af459fa8011aab2e6c38185f702e6f8fb2769ad25998a884","edge_type":"authority_input","from_ref_ids":["src-580d352a065cb696623f78452d63fb9f3ea9915e805201329bc3664e6d433d24"],"to_row_ids":["row-24c39abc4c04287fc35ee2e5c20df31d39ba48d4d2428393048e41846f55efd1"]},{"derivation":"E-C2-SOURCE-PARSE","edge_id":"edge-897800858c6d1c07b98ab63440f45fae5d846670ef0ec6f2e7c87bd4bafee926","edge_type":"authority_input","from_ref_ids":["src-7939c35fec9145c76ba1585a1fdc178b6471900197929ad5cc264ec34dc4cdcf"],"to_row_ids":["row-2a052b772e14aeb06746128255c3731547f6446a388fd531c86b80cac6ae9d9c"]},{"derivation":"E-C2-SOURCE-PARSE","edge_id":"edge-8a3c4d26ffe2b53c6659a428074a2b632b8a6fda45f8460eedb09c7afbad37d6","edge_type":"authority_input","from_ref_ids":["src-2b486e7daf7206d37c025fdb09c2b5bc56f03e8cfd96ba05b75106295483b426"],"to_row_ids":["row-6c5d9af8b0acefc1863668820e2631ffccc018b408ffc062ebaaefaef6be7989"]},{"derivation":"E-C2-SOURCE-PARSE","edge_id":"edge-915b47acf4f57984b96b20d11109b7c4fc43e7273db52f49b03261ee26d6f8fa","edge_type":"authority_input","from_ref_ids":["src-b3cdd247749f173384d9d5aca3d26de86c4f8150c0c1cdb96d803ba884296ef8"],"to_row_ids":["row-f852b93d976606dcf79b76378bb0ca5e31d268b8722f0e38767d5640cb28d5b6"]},{"derivation":"E-C2-SOURCE-PARSE","edge_id":"edge-94ad5e9deebad2d34df03bbf0dc34564e06990e5d792deb19567f0e43f8f7258","edge_type":"authority_input","from_ref_ids":["src-74b6cd996cfacb3e041812086210ce213725fd4f6fad999cadad485e5f0cdbcd"],"to_row_ids":["row-9c6c7559d606c1237d256f2abf2ba405e8730d44b7f44d4d9255fd810fcc1377"]},{"derivation":"E-C2-SOURCE-PARSE","edge_id":"edge-952db10877cadf71c352f9607347e31d0102b29b0bbf24d18a24c9a6e696d7ca","edge_type":"authority_input","from_ref_ids":["src-152caf20fdd82ccd209bdbb999d2cd61fd241664e93a4ce112d93a1a391dec0e"],"to_row_ids":["row-07b0b1eb0c56d902244763f9eba76ad6ed8acf26d988e984e072ebf6706611c5"]},{"derivation":"E-C2-SOURCE-PARSE","edge_id":"edge-9ab1479ca5a079dc8c36ac63c30f541d833fcabd51766b81841c1ac0d69818b1","edge_type":"authority_input","from_ref_ids":["src-5896643f32215e38e7c59dc6ec72c36b5d261c2abd00645200f22e1a9c47438a"],"to_row_ids":["row-08274b92fd54c603e56c33f3ee4ffa08e24af36f9cce6bdedbd9acce6fdd08b3"]},{"derivation":"E-C2-SOURCE-PARSE","edge_id":"edge-9d491126e915da4e5ba3f4ab3b0c2e63d0d1fdb75760831dd4e5201041116db4","edge_type":"authority_input","from_ref_ids":["src-572b8247d4c1ef736f7aeca09572ac052ef2fced13daf686cedc42721e768f42"],"to_row_ids":["row-8f9c5ee77764ad21f1fc5106b9dbdde1ef7b499af3f74bb9fde29f046e0dc653"]},{"derivation":"E-C2-SOURCE-PARSE","edge_id":"edge-9fb93dca77ff7474b4fb53b2e5b062e09001ae8989ce01656e88cc98130edb7e","edge_type":"authority_input","from_ref_ids":["src-bfed3222f59044beba190fd51bc5f68a240e8ee4589d0851b351601020b74714"],"to_row_ids":["row-9bc0c26693332b3896ed7aeebea77f6c82a491c9890d5cfcad57e3458eaf6afb"]},{"derivation":"E-C2-SOURCE-PARSE","edge_id":"edge-a169b8f1b469c4337955510e6dba8136fa439d10511776db0328251040d351a5","edge_type":"authority_input","from_ref_ids":["src-e03bb47871f05629909ed8ab9d808529fd882370817bafc42a2bd49e7652e769"],"to_row_ids":["row-a0273c6da58f698592191383b925810a7fac08f0017b224ca4685312baac8969"]},{"derivation":"E-C2-SOURCE-PARSE","edge_id":"edge-a1d90d882c2ef5097059cb22a2b06d7eda7403abcb1694b09b0365d10b2d68be","edge_type":"authority_input","from_ref_ids":["src-3ae17b9436af973723bc79bb318d2db82532e48a78dfd9799065c49ef195f907"],"to_row_ids":["row-ff6156988b3a2fe880d1a9c25a1ecc531ce60fdc7fc68e6246bcbf678584f5e6"]},{"derivation":"E-C2-SOURCE-PARSE","edge_id":"edge-af7c2b9067a685583525ed5ffb81a037252422d5ae33734f08600e88da1e7fe7","edge_type":"authority_input","from_ref_ids":["src-98f0c9cc68c7f1bb4038da4a254d4dd0196712f1ecf07b86a04e6c2bbadd5cde"],"to_row_ids":["row-09ba29de0ba790b0c9bad2603e9a7b4cc8668971a54d7ca25165738f44a536c4"]},{"derivation":"E-C2-SOURCE-PARSE","edge_id":"edge-b10835ddcdcc149091a4bce87d1c74ca49b997fc7a74f39319844b4f3ad7229e","edge_type":"authority_input","from_ref_ids":["src-dba8c0f9d240f1299656650575b16b49105bebbd9a6fecafb20cf25955c1173e"],"to_row_ids":["row-ef367c0e4cc7f06b1864526cd791e4f42b0781d5d3b7da864af17fc2d6665edf"]},{"derivation":"E-C2-SOURCE-PARSE","edge_id":"edge-b30a5ac98e3ef45ee1152e5ef6e65cb3f4adeb85ecf773348e5e0acdf395698d","edge_type":"authority_input","from_ref_ids":["src-2051cd298b8e4335d4b3e707bd4d6cad17776b3d0d826807fecbfb787463c403"],"to_row_ids":["row-56c72179cd6e263b5b35418ac9685155cdfd15548f75d0ad9332f9db40701847"]},{"derivation":"E-C2-SOURCE-PARSE","edge_id":"edge-bb1c6006ed9c0aec31fc33c03f2fab6516c90939a4cd7944610ea9e83229f263","edge_type":"authority_input","from_ref_ids":["src-250d2ec634d2449bd983200fa2853a3dbf941902f62c5b5ccfa4787c538b74f8"],"to_row_ids":["row-47001d8d7a199fa31aa2c72f54d3f9cad20ef024bbbe3a3085c78d8f3987635b"]},{"derivation":"E-C2-SOURCE-PARSE","edge_id":"edge-bbb0a1f9ff312fd7cf5a258b25ecd0b156949596fd7fd1d8f759fcb89cbda69c","edge_type":"authority_input","from_ref_ids":["src-77f38c257311a3988a3b080f3b4683f393446ed4eca900be5d3e7ac8e7013fca"],"to_row_ids":["row-7be828315e390b46ca18c61ec914a41a5f8518a1101095cb9ad68eccac7449c5"]},{"derivation":"E-C2-SOURCE-PARSE","edge_id":"edge-ca2275c28a6ae758940881b33a1456caeb39be4331a9e775f1f5e6bd5e6719c9","edge_type":"authority_input","from_ref_ids":["src-b30cdd53e43cd012804194d736a8ee576b9f0c7304c79b4e12404a251c1712e6"],"to_row_ids":["row-297e2e8ed